{"$schema":"https://json-schema.org/draft/2020-12/schema","title":"run.metadata","type":"object",
"required":["schema_version","run_id","macro","agent","status"],
"properties":{"schema_version":{"const":"1.0"},"run_id":{"type":"string"},"macro":{"type":"string"},
"macro_version":{"type":"string"},"agent":{"type":"string"},"subtask":{"type":["string","null"]},
"git_head":{"type":"string"},"run_key":{"type":"string"},
"status":{"enum":["started","in_progress","completed","failed"]},
"last_completed_step":{"type":["string","null"]},"started_at":{"type":"string"},"ended_at":{"type":["string","null"]}}}
