{
  "schema_version": "1.0",
  "run_id": "025-cdr-commit",
  "macro": "cdr:commit",
  "macro_version": "1",
  "agent": "cdr-commit",
  "subtask": "2b.3.5",
  "git_head": "8f8f85da9dd6e207c767c500de7f077ec894f540",
  "run_key": "issue12-2b.3.5-8f8f85d-commit",
  "status": "completed",
  "last_completed_step": "6-git-commit",
  "started_at": "2026-07-07T11:00:00Z",
  "ended_at": "2026-07-07T11:20:00Z"
}