{
  "schema_version": "1.0",
  "run_id": "2026-07-04-037-implementation",
  "macro": "cdr:implement",
  "macro_version": "1",
  "agent": "implementation",
  "subtask": "1.3.2",
  "git_head": "d51b2c29869e70a967691b330afb310003290eda",
  "run_key": "sha256:issue3-subtask1.3.2-headd51b2c2-record.go-fsync-before-apply",
  "status": "completed",
  "last_completed_step": "commit",
  "started_at": "2026-07-04T00:00:00Z",
  "ended_at": "2026-07-04T00:30:00Z"
}
