{
  "schema_version": "1.0",
  "run_id": "008-implementation",
  "macro": "cdr-implementation",
  "macro_version": "1",
  "agent": "cdr-implementation",
  "subtask": "4.2.1",
  "git_head": "2a588763515137bc52618817bfbced78f74a2b67",
  "run_key": "aefded8f5cfa3103af6a3e89cb625e4edeaec7474baebd5ffe6ccbbc05416345",
  "status": "in_progress",
  "last_completed_step": "started",
  "started_at": "2026-07-11T00:00:00Z",
  "ended_at": null
}