{
  "schema_version": "1.0",
  "run_id": "2026-07-04-065-commit",
  "macro": "cdr-commit",
  "macro_version": "1",
  "agent": "commit",
  "subtask": "1.5.2",
  "git_head": "2156b0cf3c957aba19a7a1413489616759928e60",
  "run_key": "cdr-commit|1|1.5.2|2156b0cf3c957aba19a7a1413489616759928e60|064-verification",
  "status": "completed",
  "last_completed_step": "commit_and_index_update",
  "started_at": "2026-07-04T16:12:19Z",
  "ended_at": "2026-07-04T16:20:00Z"
}
