{
  "schema_version": "1.0",
  "run_id": "028-verification",
  "macro": "cdr_verification",
  "macro_version": "1",
  "agent": "verification",
  "subtask": "4.5.2",
  "git_head": "b8da449ac555fe8c3de199c6392ad0e9b20200d0",
  "run_key": "issue24-subtask4.5.2-b8da449-on-c8c49cf",
  "status": "completed",
  "last_completed_step": "verification_json_and_regression_index_written",
  "started_at": "2026-07-11T21:28:01Z",
  "ended_at": "2026-07-11T21:45:00Z"
}
