{"schema_version":"1.0","run_id":"2026-07-11-015-cdr-commit","macro":"cdr-commit","macro_version":"1","agent":"cdr-commit","subtask":"issue-22-summary","git_head":"08f434eb2b99111afc83de7842e81dff1875200a","run_key":"issue22-4.3.1-4.3.2-08f434e","status":"completed","last_completed_step":"index_and_pending_updated","started_at":"2026-07-11T00:00:00Z","ended_at":"2026-07-11T00:05:00Z"}
