{
  "schema_version": "1.0",
  "run_id": "019-implementation",
  "macro": "cdr-implement",
  "macro_version": "1",
  "agent": "implementation",
  "subtask": "2b.3.3",
  "git_head": "ee2a658b19bc562cf1468fcbc63ed22917368e73",
  "run_key": "2b.3.3-issue12-btree-repoint-ee2a658b19bc562cf1468fcbc63ed22917368e73",
  "status": "completed",
  "last_completed_step": "handoff",
  "started_at": "2026-07-07T10:00:00+05:30",
  "ended_at": "2026-07-07T10:29:00+05:30"
}
