{
  "schema_version": "1.0",
  "run_id": "012-implementation",
  "macro": "cdr:implement",
  "macro_version": "1",
  "agent": "implementation",
  "subtask": "2b.2.2",
  "git_head": "c3191681b60bf7d3aa5d5190ee1839ae6a0c4b78",
  "run_key": "bfaf1c89a1ff088f638bfcd0b66f42f57bf0d2815888b2dcd00b3a8377402302",
  "status": "completed",
  "last_completed_step": "commit",
  "started_at": "2026-07-07T00:00:00Z",
  "ended_at": "2026-07-07T00:10:00Z"
}
