{
  "schema_version": "1.0",
  "run_id": "008-verification",
  "macro": "cdr-verify",
  "macro_version": "1",
  "agent": "cdr-verification",
  "subtask": "3.1.3 - Periodic compaction: edge logs compacted into CSR adjacency array (issue #15)",
  "git_head": "ebbc1ff0d24d641ec870cdc0a452149da2c25a4c",
  "run_key": "issue15-3.1.3-ebbc1ff-verification",
  "status": "completed",
  "last_completed_step": "verdict_written",
  "started_at": "2026-07-08T00:00:00Z",
  "ended_at": "2026-07-08T00:45:00Z"
}
