{
  "schema_version": "1.0",
  "run_id": "020-verification",
  "macro": "cdr-verify",
  "macro_version": "1",
  "agent": "verification",
  "subtask": "2b.3.3",
  "git_head": "ee2a658b19bc562cf1468fcbc63ed22917368e73",
  "run_key": "2b.3.3-ee2a658-verify-1",
  "status": "completed",
  "last_completed_step": "verdict_written",
  "started_at": "2026-07-07T05:00:00Z",
  "ended_at": "2026-07-07T05:04:00Z"
}
