{
  "schema_version": "1.0",
  "run_id": "024-cdr-commit",
  "macro": "cdr-commit",
  "macro_version": "1",
  "agent": "cdr-commit",
  "subtask": "issue-23-milestone-summary",
  "git_head": "e145fc243042eee7db5e1153857d2219aec8dbe1",
  "run_key": "cdr-commit-issue23-4.4.1-4.4.2-4.4.3-4.4.4-e145fc2",
  "status": "completed",
  "last_completed_step": "update_indexes_and_commit",
  "started_at": "2026-07-11T00:00:00Z",
  "ended_at": "2026-07-11T00:30:00Z"
}
