{
  "schema_version": "1.0",
  "run_id": "004-verification",
  "macro": "cdr-verification",
  "macro_version": "1",
  "agent": "verification",
  "subtask": "4.1.2",
  "git_head": "a4712689752d29ca585e03bdcc65d8d77c541c8c",
  "run_key": "cdr-verification-4.1.2-a4712689752d29ca585e03bdcc65d8d77c541c8c",
  "status": "completed",
  "last_completed_step": "verification.json written",
  "started_at": "2026-07-10T19:16:58Z",
  "ended_at": "2026-07-10T19:16:58Z"
}
