{
  "schema_version": "1.0",
  "run_id": "009-implementation",
  "macro": "cdr-implementation",
  "macro_version": "1",
  "agent": "cdr-implementation",
  "subtask": "issue-18/3.4.4-segment-wiring",
  "git_head": "24e2c2f1a6b8f04ccec0616501d5eaa0791daa81",
  "run_key": "cdr-implementation:1:issue-18/3.4.4-segment-wiring:24e2c2f1a6b8f04ccec0616501d5eaa0791daa81",
  "status": "in_progress",
  "last_completed_step": "started",
  "started_at": "2026-07-10T15:05:00Z",
  "ended_at": null
}
