{
  "schema_version": "1.0",
  "run_id": "2026-07-11-163-implementation",
  "macro": "cdr:implement",
  "macro_version": "1",
  "agent": "implementation",
  "subtask": "issue-43-commit-3-of-3: GrpcPutSegmentClient.put_segment populates PutSegmentRequest.path",
  "git_head": "1d28611d25b7e83238f80a40d8190a45d0cfee12",
  "run_key": "issue-43|3of3|1d28611d25b7e83238f80a40d8190a45d0cfee12|agents/ingestion/wiring.py",
  "status": "in_progress",
  "last_completed_step": "validation-matrix",
  "started_at": "2026-07-11T00:00:00+05:30",
  "ended_at": null
}
