{
  "schema_version": "1.0",
  "run_id": "007-implementation",
  "macro": "cdr:implement",
  "macro_version": "1",
  "agent": "implementation",
  "subtask": "3.1.3 - Periodic compaction: edge logs compacted into CSR adjacency array",
  "git_head": "12eca062b7f824e49faa8a2d776c56a7952b15aa",
  "run_key": "issue15-3.1.3-12eca062b7f824e49faa8a2d776c56a7952b15aa",
  "status": "in_progress",
  "last_completed_step": "none",
  "started_at": "2026-07-08T00:00:00Z",
  "ended_at": null
}
