{
  "schema_version": "1.0",
  "run_id": "2026-07-05-016-implementation",
  "macro": "cdr:implement",
  "macro_version": "1",
  "agent": "implementation",
  "subtask": "task-2a.4.1",
  "git_head": "3c0ee7e07916cc08f65ce59c00fb00282b97def2",
  "run_key": "sha256(macro=cdr:implement,version=1,subtask=task-2a.4.1,git_head=3c0ee7e07916cc08f65ce59c00fb00282b97def2,inputs=issue#9-subtask-2a.4.1)",
  "status": "completed",
  "last_completed_step": "handoff",
  "started_at": "2026-07-05T00:00:00Z",
  "ended_at": "2026-07-05T00:30:00Z"
}
