{
  "schema_version": "1.0",
  "run_id": "2026-07-06-015-commit",
  "macro": "cdr-commit",
  "macro_version": "1",
  "agent": "commit",
  "subtask": "task-2a.4.5-fix-cycle",
  "git_head": "9cd91f67aca1bf7b894204eff6d9ccce2f7baf3a",
  "run_key": "commit:task-2a.4.5-fix-cycle:b31328f:9cd91f6",
  "status": "completed",
  "last_completed_step": "index_updated",
  "started_at": "2026-07-06T00:00:00+05:30",
  "ended_at": "2026-07-06T00:10:00+05:30"
}
