{
  "schema_version": "1.0",
  "run_id": "033-cdr-commit",
  "macro": "cdr-commit",
  "macro_version": "1",
  "agent": "commit",
  "subtask": "2b.4.1-commit-close-issue-13",
  "git_head": "9ba2f0782d43342ae145cdc9db4b22e4c9b98f1c",
  "run_key": "issue13-2b.4.1-commit-9ba2f07",
  "status": "completed",
  "last_completed_step": "indexes_updated",
  "started_at": "2026-07-07T00:31:00Z",
  "ended_at": "2026-07-07T00:45:00Z"
}
